{
  "brand_name": "Diana",
  "mission_vision": null,
  "sponsorship_activities": [],
  "channels": [],
  "industry": {
    "Primary_Industry": "Agricultural Machinery",
    "Secondary_Industry": "Manufacturing"
  },
  "regions": [
    "Greece"
  ],
  "interests": [],
  "audience_lifestyle": [],
  "languages": [
    "Greek"
  ],
  "business_model_canvas": {
    "Key_Partners": [],
    "Key_Activities": [],
    "Value_Propositions": [],
    "Customer_Relationships": [],
    "Customer_Segments": [],
    "Channels": [],
    "Cost_Structure": [],
    "Revenue_Streams": []
  },
  "link": "https://en.wikipedia.org/wiki/Diana_(agricultural_machinery)",
  "parsed_at": "2024-10-01T14:38:11.645442Z",
  "country": "Greek brands",
  "category": "Motor vehicle manufacturers of Greece",
  "body_text": "From Wikipedia, the free encyclopedia Brand of Greek agricultural machinery Diana V3 12 hp light tractor with truck bed This article has multiple issues. Please help improve it or discuss these issues on the talk page . ( Learn how and when to remove these messages ) This article includes a list of references , related reading , or external links , but its sources remain unclear because it lacks inline citations . Please help improve this article by introducing more precise citations. ( July 2024 ) ( Learn how and when to remove this message ) ( Learn how and when to remove this message ) Diana (Διάνα) is the brand name for agricultural machinery produced by Irene Chrissadakou A.E. a company located in Tavros ( Athens ), Greece . Founded in 1976, it is one of the most successful light tractor manufacturers in Greece, [ citation needed ] also managing to survive the crisis in Greek manufacturing industry of the 1980s and 1990s. Diana light truck with cross-country capability (1979) Diana has produced a wide range of machinery and accessories. Between 1979 and 1984 it developed and produced a type of light truck in \"open\" and \"closed\" cab versions, 18 hp Ruggerini Diesel engine (license produced by Mekmotors Hellas), max speed 67 km/h, 1 ton payload and cross-country capability, as well as a number of light tractor models. L.S. Skartsis, \"Encyclopedia of Greek vehicles and aircraft\", Achaikes Ekdoseis/Typorama, Patras, Greece (1995) ISBN 960-7620-00-3 L.S. Skartsis, \"Greek Vehicle & Machine Manufacturers 1800 to present: A Pictorial History\", Marathon (2012) ISBN 978-960-93-4452-4 (eBook) Company website This tool article is a stub . You can help Wikipedia by expanding it . v t e This agriculture article is a stub . You can help Wikipedia by expanding it . v t e Retrieved from \" https://en.wikipedia.org/w/index.php?title=Diana_(agricultural_machinery)&oldid=1238688989 \" Categories : Agricultural machinery manufacturers of Greece Tractor manufacturers of Greece Truck manufacturers of Greece Motor vehicle manufacturers of Greece Greek brands Companies of Greece Tool stubs Agriculture stubs Hidden categories: Articles with short description Short description is different from Wikidata Use dmy dates from August 2021 Articles lacking in-text citations from July 2024 All articles lacking in-text citations Articles with multiple maintenance issues All articles with unsourced statements Articles with unsourced statements from March 2011 All stub articles",
  "infobox": {},
  "company_name": "Unknown",
  "logo_url": "No logo available"
}