{
  "brand_name": "Te & Kaffi",
  "mission_vision": null,
  "sponsorship_activities": [],
  "channels": [],
  "industry": {
    "Primary_Industry": "Coffee shop",
    "Secondary_Industry": "Food and beverage"
  },
  "regions": [
    "Iceland"
  ],
  "interests": [
    {
      "category": "Social and Lifestyle Interests",
      "specifics": [
        "Coffee",
        "Tea",
        "Baked goods"
      ]
    }
  ],
  "audience_lifestyle": null,
  "languages": [
    "Icelandic",
    "English"
  ],
  "business_model_canvas": {
    "Key_Partners": [],
    "Key_Activities": [],
    "Value_Propositions": [],
    "Customer_Relationships": [],
    "Customer_Segments": [],
    "Channels": [],
    "Cost_Structure": [],
    "Revenue_Streams": []
  },
  "link": "https://en.wikipedia.org/wiki/Te_%26_Kaffi",
  "parsed_at": "2024-10-01T14:38:08.292121Z",
  "country": "Icelandic brands",
  "category": "General",
  "body_text": "From Wikipedia, the free encyclopedia Te & Kaffi Native name Te og Kaffi Industry Coffee shop Founded April 28, 1984 ; 40 years ago ( 1984-04-28 ) Founders Berglind Guðbrandsdóttir Sigmundur Dýrfjörð Headquarters Stapahraun 4, Hafnarfjörður , Iceland Number of locations 14 Products Coffee beverages Smoothies Tea Baked goods Sandwiches Website www .teogkaffi .is Te & Kaffi is an Icelandic coffee company and coffeehouse chain . Established in 1984 by Berglind Guðbrandsdóttir and Sigmundur Dýrfjörð, Te & Kaffi operates Iceland's biggest coffee roastery , a chain of 9 coffeehouses and a wholesale business focusing on coffee, loose-leaf tea and other related products. [ 1 ] This article about an Icelandic corporation or company is a stub . You can help Wikipedia by expanding it . v t e Retrieved from \" https://en.wikipedia.org/w/index.php?title=Te_%26_Kaffi&oldid=1166138224 \" Categories : Drink companies of Iceland Icelandic brands Coffeehouses and cafés Food and drink companies established in 1984 1984 establishments in Iceland Coffee in Europe Agricultural organizations based in Iceland Icelandic company stubs Hidden category: All stub articles",
  "infobox": {
    "logo_url": "https://upload.wikimedia.org/wikipedia/en/thumb/c/cb/Teogkaffi_logo.svg/200px-Teogkaffi_logo.svg.png",
    "name": "",
    "native_name": "Te og Kaffi",
    "industry": "Coffee shop",
    "founded": "April 28, 1984 ; 40 years ago ( 1984-04-28 )",
    "founders": "Berglind Guðbrandsdóttir Sigmundur Dýrfjörð",
    "headquarters": "Stapahraun 4, Hafnarfjörður , Iceland",
    "number_of_locations": "14",
    "products": "Coffee beverages Smoothies Tea Baked goods Sandwiches",
    "website": "www .teogkaffi .is"
  },
  "company_name": "Unknown",
  "logo_url": "https://upload.wikimedia.org/wikipedia/en/thumb/c/cb/Teogkaffi_logo.svg/200px-Teogkaffi_logo.svg.png"
}