{
  "brand_name": "Wilson, Sons Limited",
  "mission_vision": null,
  "sponsorship_activities": [],
  "channels": [],
  "industry": {
    "Primary_Industry": "Port and Maritime Logistics",
    "Secondary_Industry": "Shipping"
  },
  "regions": [
    "Brazil"
  ],
  "interests": [
    {
      "category": "Professional and Educational Interests",
      "specifics": [
        "Logistics",
        "Shipping"
      ]
    }
  ],
  "audience_lifestyle": null,
  "languages": [
    "Portuguese",
    "English"
  ],
  "business_model_canvas": {
    "Key_Partners": [],
    "Key_Activities": [
      "Port Terminals",
      "Towage",
      "Logistics",
      "Shipping Agency",
      "Offshore Services",
      "Shipyards"
    ],
    "Value_Propositions": [
      "Integrated port and maritime logistics",
      "Comprehensive supply chain solutions"
    ],
    "Customer_Relationships": [],
    "Customer_Segments": [],
    "Channels": [],
    "Cost_Structure": [],
    "Revenue_Streams": [
      "Service Fees",
      "Shipping Revenues"
    ]
  },
  "link": "https://en.wikipedia.org/wiki/Wilson,_Sons",
  "parsed_at": "2024-10-01T14:39:19.111401Z",
  "country": "Brazilian brands",
  "category": "General",
  "body_text": "From Wikipedia, the free encyclopedia Wilson, Sons Limited Company type Public limited company Traded as B3 : PORT3 Industry Port and Maritime Logistics Founded 1837 ; 187 years ago ( 1837 ) Headquarters Rio de Janeiro , Brazil Area served Brazil Key people Fernando Salek, ( CEO ) Products Port Terminals , Towage , Logistics , Shipping Agency , Offshore , and Shipyards . Revenue US$ 666.2 million (2012) Net income US$ 49.5 million (2012) Number of employees 4,936 Website wilsonsons.com.br Wilson Sons ( B3 : PORT3 ) is a Brazilian shipping company headquartered in Rio de Janeiro , Brazil . The firm was set up in Salvador in 1837 by two Scottish brothers, Edward and Fleetwood Pellew Wilson. The firm is one of the oldest private enterprises in Brazil. It was later run by Edward's son, Edward Pellew Wilson Jr. Wilson Sons were responsible for construction and provision of supplies and equipment for the Great Western and Count d'Eu Railroads in Brazil. The group built the first dry dock in Brazil, on the Ilha de Mocangue Pequeno Island, inaugurated in 1869 by Emperor Dom Pedro II . Today, Wilson Sons Limited, through its subsidiaries, is one of Brazil's largest providers of integrated port and maritime logistics and supply chain solutions. [ clarification needed ] The company has developed an extensive national network and provides a comprehensive set of services related to domestic and international trade, as well as to the oil and gas industry. Its principal operating activities are divided into the following lines of business: port terminals , towage , logistics, shipping agency , offshore , and shipyards . [ 1 ] Wilson, Sons web site (English language) Retrieved from \" https://en.wikipedia.org/w/index.php?title=Wilson,_Sons&oldid=1211743471 \" Categories : Brazilian brands Companies based in Rio de Janeiro (state) Companies based in Rio de Janeiro (city) Companies established in 1837 Companies listed on B3 (stock exchange) Defence companies of Brazil Engineering companies of Brazil Manufacturing companies of Brazil Manufacturing companies established in 1837 Multinational companies headquartered in Brazil Military history of Brazil Shipbuilding companies of Brazil Shipping companies of Brazil Vehicle manufacturing companies established in the 19th century Hidden categories: Use dmy dates from August 2022 Wikipedia articles needing clarification from June 2022",
  "infobox": {
    "company_type": "Public limited company",
    "traded_as": "B3 : PORT3",
    "industry": "Port and Maritime Logistics",
    "founded": "1837 ; 187Â years ago ( 1837 )",
    "headquarters": "Rio de Janeiro , Brazil",
    "area_served": "Brazil",
    "key_people": "Fernando Salek, ( CEO )",
    "products": "Port Terminals , Towage , Logistics , Shipping Agency , Offshore , and Shipyards .",
    "revenue": "US$ 666.2 million (2012)",
    "net_income": "US$ 49.5 million (2012)",
    "number_of_employees": "4,936",
    "website": "wilsonsons.com.br"
  },
  "company_name": "Unknown",
  "logo_url": "No logo available"
}